{
  "schema_version": "0.1.0",
  "kind": "evidence",
  "evidence_id": "EVIDENCE-0005",
  "space_id": "mingos-project",
  "task_id": "TASK-0005",
  "evidence_type": "test",
  "summary": "第二外部空间已验证：mingos-unified 无 Manifest，通过显式 space_seed 完成 analyze/scaffold；来源 README 与仓库地图按 Git Blob 固定，Seed 模式强制人工复核且不自动语义解释。GitHub Actions run 31108962365 全部通过，PR #10 已合并。",
  "uri": "https://github.com/YuemingHub/MingOS/actions/runs/31108962365",
  "verification_status": "passed",
  "produced_by_actor_id": "agent-continuity",
  "verified_by_actor_id": "agent-continuity",
  "created_at": "2026-08-06T14:05:00Z"
}
