{
  "schema_version": "0.1.0",
  "kind": "evidence",
  "evidence_id": "EVIDENCE-0001",
  "space_id": "mingos-project",
  "task_id": "TASK-0001",
  "evidence_type": "test",
  "summary": "npm check 在本地参考环境通过；CI 将在 PR 上复验",
  "uri": ".github/workflows/validate.yml",
  "verification_status": "passed",
  "produced_by_actor_id": "agent-bootstrap",
  "verified_by_actor_id": "agent-bootstrap",
  "created_at": "2026-08-06T09:42:00Z"
}
